{
  "schema_version": "1",
  "contract_identity": "vss.provider-certification",
  "contract_version": "1",
  "provider": "Google Cloud Vertex AI",
  "product_service": "Veo video generation",
  "model_version": "veo-3.1-generate-001",
  "supported_regions": ["us-central1"],
  "generation_modes": ["image-to-video"],
  "request_schema_mapping": {
    "transport": "POST https://us-central1-aiplatform.googleapis.com/v1/projects/{PROJECT_ID}/locations/us-central1/publishers/google/models/veo-3.1-generate-001:predictLongRunning; polling POST to same resource :fetchPredictOperation",
    "mapping": {"prompt": "instances[0].prompt", "image": "instances[0].image (bytesBase64Encoded plus mimeType)", "duration_seconds": "parameters.durationSeconds=8", "resolution": "parameters.resolution=720p; parameters.aspectRatio=16:9", "sample_count": "parameters.sampleCount=1"},
    "unknowns": []
  },
  "authentication": {"requirements": ["Google OAuth 2.0 bearer access token (Application Default Credentials or gcloud auth print-access-token); Vertex AI API enabled; principal requires Vertex AI request permission in the project"], "unknowns": ["current configured access token was rejected with HTTP 401 by read-only Cloud Resource Manager and Service Usage checks; current principal identity and effective request IAM are unconfirmed"]},
  "submission_semantics": {"method": "POST :predictLongRunning; one instance with image and prompt; generateAudio=false; sampleCount=1; no storageUri", "accepted_response": "HTTP 200 JSON operation name; operation is durably recorded before polling", "provider_calls": 0},
  "async_operation_semantics": {"fetch_method": "POST :fetchPredictOperation", "operation_name_required": true, "polling": "Long-running operation returns name; send {operationName: full_name}; done=false means pending; done=true means terminal response or error"},
  "polling_fetch_semantics": {"method": "POST https://us-central1-aiplatform.googleapis.com/v1/projects/{PROJECT_ID}/locations/us-central1/publishers/google/models/veo-3.1-generate-001:fetchPredictOperation with operationName", "same_operation_recovery": true, "unknowns": ["maximum provider processing time is not documented as a fixed bound"]},
  "terminal_response_forms": [{"kind": "inline_base64", "field": "response.videos[].bytesBase64Encoded", "mime": "video/mp4"}, {"kind": "cloud_storage_uri", "field": "response.videos[].gcsUri", "mime": "video/mp4"}],
  "artifact_delivery_forms": ["inline response.videos[].bytesBase64Encoded (video/mp4): supported by VSS; selected when storageUri omitted", "response.videos[].gcsUri (video/mp4): provider-supported when Cloud Storage output is configured; VSS integration rejects URI retrieval and does not support it for this profile"],
  "recovery_semantics": {"rule": "persist accepted full operation name and fetch that same operation after interruption; never resubmit", "duplicate_submission": false},
  "media_contract": {"duration_seconds": [8], "image_to_video_duration_seconds": [8], "resolution": ["720p (16:9 = 1280x720)"], "fps": [24], "audio": "Provider supports generateAudio true/false; VSS profile sends generateAudio=false. Historical MP4 has no audio stream.", "maximum_outputs": 1, "image_max_bytes": 20971520},
  "quota_evidence": {"mode": "fixed quota", "recorded_local_evidence": ".local/config/m11-0-veo-quota-evidence.json (historical, 50 requests/minute)", "metric": "aiplatform.googleapis.com/long_running_online_prediction_requests_per_base_model", "project": "vss-film-poc", "effective_limit": 50, "freshness": "UNKNOWN: live read-only quota API check could not authenticate (HTTP 401); historical evidence has no freshness timestamp"},
  "pricing_evidence": {"expected_shot_cost_usd": "UNKNOWN", "hard_ceiling_usd": "5.000000", "rate_basis": "Google pricing page currently lists Veo 3.1 video-only 720p/1080p at $0.20 per 1 count, but does not define count as a second or 8-second video in the cited table; do not extrapolate.", "authoritative_quote": "Google Agent Platform pricing page, Veo 3.1 Video generation, 720p/1080p, $0.20 / 1 count; checked 2026-09-11"},
  "unsupported_probes": ["GET publisher model metadata is not a supported readiness assumption; observed HTTP 404 is non-diagnostic for Veo availability", "generation submission as a readiness probe", "referenceImages input on veo-3.1-generate-001 (documented unsupported; preview identifier is distinct)", "Cloud Storage URI output retrieval in the current VSS integration"],
  "deprecations": ["veo-3.1-generate-preview is a distinct identifier and was migrated to veo-3.1-generate-001; do not substitute preview", "Google lifecycle documentation currently lists veo-3.1-generate-001 retirement as November 17, 2026 or later; recheck before later execution"],
  "authoritative_sources": [
    {"title": "Veo 3.1 model documentation", "url": "https://cloud.google.com/vertex-ai/generative-ai/docs/models/veo/3-1-generate", "claims": ["model ID", "image-to-video support; referenceImages unsupported", "us-central1 region", "16:9", "720p/1080p", "24 FPS", "8-second image-to-video duration", "video/mp4", "generateAudio supported as a boolean", "fixed quota"]},
    {"title": "Generate videos with Veo on Vertex AI from text prompts", "url": "https://cloud.google.com/vertex-ai/generative-ai/docs/video/generate-videos-from-text", "claims": ["predictLongRunning endpoint", "operation response", "supported model identifiers", "720p/1080p", "sample count"]},
    {"title": "Veo video generation API reference", "url": "https://cloud.google.com/vertex-ai/generative-ai/docs/model-reference/veo-video-generation", "claims": ["image request shape", "durationSeconds", "resolution", "aspectRatio", "sampleCount", "generateAudio", "predictLongRunning", "fetchPredictOperation", "operationName", "inline Base64 or GCS URI response"]},
    {"title": "Veo lifecycle documentation", "url": "https://docs.cloud.google.com/gemini-enterprise-agent-platform/models/model-versions", "claims": ["Veo 3.1 GA model lifecycle and November 17, 2026 or later retirement date"]},
    {"title": "Veo model availability and region", "url": "https://docs.cloud.google.com/gemini-enterprise-agent-platform/models/veo/3-1-generate", "claims": ["us-central1 availability and supported media formats"]},
    {"title": "Veo pricing", "url": "https://cloud.google.com/vertex-ai/generative-ai/pricing", "claims": ["current Veo 3.1 video-only 720p/1080p rate displayed as $0.20 per count; unit meaning unresolved"]},
    {"title": "Veo quota documentation", "url": "https://docs.cloud.google.com/gemini-enterprise-agent-platform/models/quotas", "claims": ["quota metric long_running_online_prediction_requests_per_base_model"]},
    {"title": "Provider specialist certification review", "url": "docs/provider-certifications/google-vertex-ai-veo-3.1-review.md", "claims": ["field-by-field status, evidence freshness, live check failure, historical conformance, independent review"]}
  ],
  "conformance": {"status": "passed", "fixtures": ["tests/provider_reliability/test_certification.py", "tests/movie_storyboard/test_m11_2_film1_shot2_plan.py"], "provider_calls": 0},
  "live_certification": {"status": "UNKNOWN", "certified_at": null, "evidence": ["Non-generation project, service, and quota reads returned HTTP 401 using the configured access token; no generation endpoint was called", "historical fixed-quota evidence is not fresh; pricing page unit does not establish an 8-second cost", "provider profile facts and historical successful operations reviewed independently in docs/provider-certifications/google-vertex-ai-veo-3.1-review.md"]},
  "production_eligibility": {"eligible": false, "reason": "The bounded profile is not yet certified because current project/auth/quota readiness and an authoritative 8-second rate calculation are unresolved; optional reference-image capability is unsupported and outside this profile"},
  "authority": {"provider_execution": false, "production": false, "publication": false, "workflow_activation": false, "retry": false, "fallback": false}
}
